{
  "$schema": "frozen-visual-calibration.schema.json",
  "schemaVersion": 1,
  "phase": "phase-1b-frozen-visual-calibration",
  "generator": "phase1b-frozen-calibration-v1",
  "generatedAt": "2026-08-19T14:45:47.792093+00:00",
  "status": "CONDITIONAL",
  "sourceIdentity": {
    "frozenVideoSha256": "b6e79250c75e0357e489de87b63ffd4a5097a573eb7baced35e5de8b050c2435",
    "frozenSanitizedManifestSha256": "fc52e6524c22cccfbabbf05e037f3588f9d2329e92fac3eddb22cfc98a1b58e7",
    "frozenCanonicalManifestSha256": "4d05c3fdae8fff0160710b40aa375732d851d61b3612fd4bb1a4c0a732e14669",
    "frozenArtifactSetSha256": "438e12eb7ca0c47e8a64a3dfa51efad007a0e51b91080939f0d5736c03369821",
    "frozenPrivateManifestSha256": "4d5d07c7cf62e850dd0613b9078470955bbf74d72f01b14a4707e177e411f5d5",
    "localCaptureManifestSha256": "6c6bd2e60784d4845556b4ff80a2ee86a1d158d85b772b7e009f1667fa83a5c2",
    "localHead": "7f9295b45d21349930037643ecc5ce71139c5d79",
    "localRuntimeSourceSetSha256": "1d6bfdb59f1a125ec85c33971d2f5e13c175511568cf1469fe58eba6ce2aefbb",
    "localDirtyRepository": false,
    "localDirtyWithinRuntimeScope": false,
    "files": [
      {
        "path": "glass-lab-v4.html",
        "sha256": "208b4ccfdae775543d59acb46a55ac93e905969046b09c7b563f1c6708b74399"
      },
      {
        "path": "vite.config.ts",
        "sha256": "8e0bb832943f7ef74d998484f09f72b117e04ca77f18ab9dfefc7198775371e3"
      },
      {
        "path": "src/config.ts",
        "sha256": "4732f33ac0debaebff458b2b7b4f553e5b3f4be9df451e7491410796cdac7775"
      },
      {
        "path": "src/lab-v4/lab.css",
        "sha256": "51f8665155e80773012952c568bd874bba3c2abe220f5f089badcbd0d53dc0a2"
      },
      {
        "path": "src/lab-v4/main.ts",
        "sha256": "14c2193e71b15d9f9515f0b4d704842754a5c0286af66c253f7a95b69e65ea97"
      },
      {
        "path": "src/lab-v4/patterns.ts",
        "sha256": "66288bbd149eb2551f839e5393c4b844c689dcf8a812d914c9a349f9b33f7444"
      },
      {
        "path": "src/lab-v4/types.ts",
        "sha256": "3d3c7735279671288a1117043971670344e4edea8eecca0863aa3b1cf09f4e00"
      },
      {
        "path": "src/materials/LiquidGlassMaterial.ts",
        "sha256": "70de5d3b93349900e6477d5c9b1ae46b933c7ed15807a117d8937c68ee90563d"
      },
      {
        "path": "src/materials/LiquidGlassMaterialV4.ts",
        "sha256": "f5ab91ca0d07482f576e0353f009273b9ec489b260e228ebccc5d1f4fe5e3db4"
      },
      {
        "path": "src/rendering/SceneColorTargetV4.ts",
        "sha256": "a7ea5d7c415e82b173abe59ef9c38264ec63a3f66d2dc838324a1af3388e8457"
      },
      {
        "path": "src/scene/ConvexGlassGeometry.ts",
        "sha256": "e4543a5313d7c2a3b5066cffb61621062e23401dfa8a13e180d54516a8131bda"
      },
      {
        "path": "src/scene/ConvexGlassGeometryV4.ts",
        "sha256": "f5bee08c681db8e7bee0076dc39f4b4440064f39e80fdda21d22a8a46bb5b118"
      },
      {
        "path": "src/v4/OpticsConfigV4.ts",
        "sha256": "03e4a25dd5f719e1714ffae417bb5a8204b762a5e27b360aa161434711224986"
      },
      {
        "path": "src/v4/StripLightEnvironmentV4.ts",
        "sha256": "8b78be55c636ef9f629a7c08fe95834e9de8087bcdbe84a7d803d8f623846ef2"
      }
    ],
    "calibrationPriorSha256": "70052da01c71d5447c32b9053100d033be4ac380296e354e9a883cab4477af8b",
    "annotationSetSha256": null
  },
  "captureAttestation": {
    "status": "PASS",
    "sourceIdentityCheckPassed": true,
    "sourceIdentityStartDigest": "2055c106e0088b487b1b7c51cca17be310e0c9e369ac5c87d819ecb28a03e8bc",
    "sourceIdentityEndDigest": "2055c106e0088b487b1b7c51cca17be310e0c9e369ac5c87d819ecb28a03e8bc",
    "previewPassed": true,
    "previewOriginPublished": false,
    "distTreeSha256": "2f7cc92fbd42ba62ae7018ec94627a9837a9212fda018c1491815b52b590536f",
    "distFileCount": 31,
    "servedResourceManifestSha256": "ecebecb81bde6ee98da65e28a4ec5ab15e88c106255b7765af7d65b8a00c2856",
    "servedResourceCount": 7,
    "runtimeContractPassed": true,
    "hardwareWebGpu": true,
    "adapter": {
      "vendor": "apple",
      "architecture": "metal-3",
      "isFallbackAdapter": false
    },
    "pageErrorCount": 0,
    "captureScriptSha256": "1fb9acf5d5d826a740177f50201463154b7cae9c93da954856fe166133bfcfe4",
    "captureScriptVersion": "optics-lab-capture-phase1b-v2",
    "screenshotSetSha256": "759c3190bc740d9b89d7c8bd70dee2a66685f3b4f293a6eef51e957370ce75f5",
    "sessionVideoSha256": "2f3fec6b832920b01cae8f4f79396c07f8358ea13f23a7494408260776a76c7b",
    "captureCount": 58
  },
  "evidenceIntegrity": {
    "status": "PASS",
    "frozenArtifactCategoryCount": 8,
    "frozenArtifactHashCount": 88,
    "localCaptureHashCount": 58,
    "privatePixelsCommittedByThisReport": false
  },
  "targetTruth": {
    "status": "MISSING",
    "approvedCategoryCount": 0,
    "reason": "private-human-reviewed-annotations-missing",
    "fallbackZoneSourcesObserved": [
      "configured-initial-mask-not-measured-target-optics"
    ],
    "fallbackZonesAcceptedAsTargetTruth": false,
    "provisionalStrongLensRim": {
      "status": "CONDITIONAL",
      "evidenceClass": "provisional-user-measurement",
      "unit": "card-short-side",
      "min": 0.046,
      "max": 0.049,
      "center": 0.0475,
      "initialLocalGate": [
        0.045,
        0.055
      ],
      "maximumResultStatus": "CONDITIONAL",
      "mayClaimPixelTruth": false,
      "note": "User-provided 4.6%-4.9% estimate; provisional Phase 1B calibration prior, not measured Frozen pixel truth."
    },
    "finalTargetTruthStatus": "BLOCKED"
  },
  "roleMapping": {
    "bright": {
      "targetCategory": "bright-front",
      "targetFrameSha256": "11bc11bc659ed827ec2569210425b0c67dc7751ba1674779a79178ad25b8a897",
      "frameReuse": [
        "bright"
      ],
      "targetReviewStatus": "PENDING",
      "targetProfileSummary": {
        "top": {
          "coverage": 0.9710040952978806,
          "sampleCount": 32483,
          "medianLuma": 0.45417292416095734,
          "medianChroma": 0.12035800144076347,
          "medianSharpness": 0.06451116129755974
        },
        "right": {
          "coverage": 0.9984068916686335,
          "sampleCount": 16921,
          "medianLuma": 0.08329520002007484,
          "medianChroma": 0.06490684300661087,
          "medianSharpness": 0.034041352570056915
        },
        "bottom": {
          "coverage": 0.9977680564235336,
          "sampleCount": 33528,
          "medianLuma": 0.10074492543935776,
          "medianChroma": 0.06169256567955017,
          "medianSharpness": 0.03167141601443291
        },
        "left": {
          "coverage": 0.8571428571428571,
          "sampleCount": 14538,
          "medianLuma": 0.4419707804918289,
          "medianChroma": 0.15854163467884064,
          "medianSharpness": 0.08013727515935898
        },
        "topLeft": {
          "coverage": 0.9407012719147473,
          "sampleCount": 10946,
          "medianLuma": 0.3507433384656906,
          "medianChroma": 0.19905780255794525,
          "medianSharpness": 0.0732194222509861
        },
        "topRight": {
          "coverage": 0.9285221589929298,
          "sampleCount": 10769,
          "medianLuma": 0.2666208744049072,
          "medianChroma": 0.0975760817527771,
          "medianSharpness": 0.09127843007445335
        },
        "bottomRight": {
          "coverage": 1.0,
          "sampleCount": 11599,
          "medianLuma": 0.01827702671289444,
          "medianChroma": 0.012536473572254181,
          "medianSharpness": 0.009656219277530909
        },
        "bottomLeft": {
          "coverage": 0.9878803506962351,
          "sampleCount": 11493,
          "medianLuma": 0.24756520241498947,
          "medianChroma": 0.09993136674165726,
          "medianSharpness": 0.04132096283137798
        }
      },
      "local": {
        "status": "MEASURED",
        "value": {
          "captureId": "v4-white",
          "captureSha256": "849e49ac6fd840bd178bee44d5cc538ba4ed85821be9327142c62fced1706780",
          "pose": "front",
          "poseOpticalZonesCaptureId": "phase1b-optical-zones-front",
          "poseOpticalZonesSha256": "31ff6b33a3d875d7b8824e060ded01125f547016f1011318e0f3281872d28be7",
          "profileSummary": {
            "top": {
              "coverage": 1.0,
              "sampleCount": 33120,
              "medianLuma": 0.7363052666187286,
              "medianChroma": 0.019319080747663975,
              "medianSharpness": 0.0002484162396285683
            },
            "right": {
              "coverage": 1.0,
              "sampleCount": 16480,
              "medianLuma": 0.7287186980247498,
              "medianChroma": 0.0219419002532959,
              "medianSharpness": 0.0007390886312350631
            },
            "bottom": {
              "coverage": 1.0,
              "sampleCount": 33120,
              "medianLuma": 0.7363035380840302,
              "medianChroma": 0.01939716748893261,
              "medianSharpness": 0.0002528766854084097
            },
            "left": {
              "coverage": 1.0,
              "sampleCount": 16480,
              "medianLuma": 0.728723794221878,
              "medianChroma": 0.021939539350569248,
              "medianSharpness": 0.0007390674145426601
            },
            "topLeft": {
              "coverage": 1.0,
              "sampleCount": 14365,
              "medianLuma": 0.7326954007148743,
              "medianChroma": 0.019902889616787434,
              "medianSharpness": 0.0016891149571165442
            },
            "topRight": {
              "coverage": 1.0,
              "sampleCount": 14364,
              "medianLuma": 0.7326789200305939,
              "medianChroma": 0.020709616132080555,
              "medianSharpness": 0.0012584099313244224
            },
            "bottomRight": {
              "coverage": 1.0,
              "sampleCount": 14364,
              "medianLuma": 0.7326960861682892,
              "medianChroma": 0.020535271614789963,